{
	"name": "Foo",
	"url" : "http://example.org",
	"license": "GPL",
	"tags": ["foo", "test"],
	"description": "This project is an example of an haxelib project",
	"version": "1.0.0",
	"releasenote": "Initial release, everything is working correctly",
	"dependencies": {
		"Bar": "hg:./libraries/libBar"
	},
	"contributors": ["Foo"]
}
